Headline,Summary,News Link,News Title,News Summary
Oxford vaccine: How did they make it so quickly?,,https://www.bbc.com//news/health-55041371,Oxford vaccine: How did they make it so quickly? - BBC News,"By James GallagherHealth and science correspondent Ten years' vaccine work achieved in about 10 months. Yet no corners cut in designing, testing and manufacturing. They are two statements that sound like a contradiction, and have led some to ask how we can be sure the Oxford vaccine - which has published its first results showing it is highly effective at stopping Covid-19 - is safe when it has been made so fast.  So, this is the real story of how the Oxford vaccine happened so quickly.  It is one that relies on good fortune as well as scientific brilliance; has origins in both a deadly Ebola outbreak and a chimpanzee's runny nose; and sees the researchers go from having no money in the bank to chartering private planes.  The biggest misconception is the work on the vaccine started when the pandemic began.  The world's biggest Ebola outbreak in 2014-2016 was a catastrophe. The response was too slow and 11,000 people died.  ""The world should have done better,"" Prof Sarah Gilbert, the architect of the Oxford vaccine, told me.   In the recriminations that followed, a plan emerged for how to tackle the next big one. At the end of a list of known threats was ""Disease X"" - the sinister name of a new, unknown infection that would take the world by surprise.  The Jenner Institute at the University of Oxford - named after the scientist that performed the first vaccination in 1796, and now home to some of the world's leading experts - designed a strategy for defeating an unknown enemy.  ""We were planning how can we go really quickly to have a vaccine in someone in the shortest possible time,"" Prof Gilbert said.  ""We hadn't got the plan finished, but we did do pretty well."" The central piece of their plan was a revolutionary style of vaccine known as ""plug and play"". It has two highly desirable traits for facing the unknown - it is both fast and flexible.  Conventional vaccines - including the whole of the childhood immunisation programme - use a killed or weakened form of the original infection, or inject fragments of it into the body. But these are slow to develop.   Instead the Oxford researchers constructed ChAdOx1 - or Chimpanzee Adenovirus Oxford One. Scientists took a common cold virus that infected chimpanzees and engineered it to become the building block of a vaccine against almost anything.  Before Covid, 330 people had been given ChAdOx1 based-vaccines for diseases ranging from flu to Zika virus, and prostate cancer to the tropical disease chikungunya. The virus from chimps is genetically modified so it cannot cause an infection in people. It can then be modified again to contain the genetic blueprints for whatever you want to train the immune system to attack. This target is known is an antigen.  ChAdOx1 is in essence a sophisticated, microscopic postman. All the scientists have to do is change the package. ""We drop it in and off we go,"" said Prof Gilbert. While much of the world was having a lie-in after New Year's Eve, Prof Gilbert noticed concerning reports of ""viral pneumonia"" in Wuhan, China. Within two weeks scientists had identified the virus responsible and began to suspect it was able to spread between people.  ""We'd been planning for disease X, we'd been waiting for disease X, and I thought this could be it,"" Prof Gilbert said. At this point, the team did not know how important their work would become. It started out as a test of how fast they could go and as a demonstration of the ChAdOx1 technology. Prof Gilbert said: ""I thought it might only have been a project, we'd make the vaccine and the virus would fizzle out. But it didn't."" It sounds strange to say it, almost perverse, but it was lucky that the pandemic was caused by a coronavirus.  This family of viruses had tried to jump from animals to people twice before in the past 20 years - Sars coronavirus in 2002 and Mers coronavirus in 2012. It meant scientists knew the virus's biology, how it behaved and its Achilles heel - the ""spike protein"". ""We had a huge head start,"" Prof Andrew Pollard from the Oxford team said. The spike protein is the key the virus uses to unlock the doorway into our body's cells. If a vaccine could train the immune system to attack the spike, then the team knew they were odds-on to succeed. And they had already developed a ChAdOx1 vaccine for Mers, which could train the immune system to spot the spike. The Oxford team were not starting from scratch.   ""If this had been a completely unknown virus, then we'd have been in a very different position,"" Prof Pollard added.  It was also lucky that coronaviruses cause short-term infections. It means the body is capable of beating the virus and a vaccine just needs to tap into that natural process.  If it had been a long-term or chronic infection that the body cannot beat - like HIV - then it's unlikely a vaccine could work.  On 11 January, Chinese scientists published and shared with the world the full genetic code of the coronavirus. The team now had everything they needed to make a Covid-19 vaccine.  All they had to do was slip the genetic instructions for the spike protein into ChAdOx1 and they were good to go. Making a vaccine is very expensive.  ""The first bit was quite painful. There was a period when we didn't have any money in the bank,"" said Prof Pollard.  They had some funding from the university, but they had a crucial advantage over other groups around the world.  On the site of Churchill hospital in Oxford is the group's own vaccine manufacturing plant.  ""We could say stop everything else and make this vaccine,"" said Prof Pollard. It was enough to get going, but not to make the thousands of doses needed for larger trials.  ""Getting money was my main activity until April, just trying to persuade people to fund it now,"" said Prof Gilbert.  But as the pandemic tightened its grip on the world and country after country descended into lockdown, the money started to flow. Production of the vaccine moved to a facility in Italy and the money helped solve problems that would have otherwise held up the trials, including the logistical nightmare of lockdown Europe. ""At one point we had to charter a plane, the vaccine was in Italy and we had clinics here the next morning,"" said Prof Gilbert.  Quality control is never the sexiest part of a project, but researchers cannot start giving an experimental vaccine to people until they are sure it has been made to a high enough standard.  At every stage of the manufacturing process, they needed to ensure the vaccine was not being contaminated with viruses or bacteria. In the past this had been a lengthy process.  ""If we had not been thinking about how to shorten the time, we might have had a vaccine in March but not started trials until June.""  Instead, once animal trials had shown the vaccine was safe, the researchers were able to begin human trials of the vaccine on 23 April.  Since then the Oxford vaccine has been through every stage of trials that would normally take place for a vaccine.  There is a pattern to clinical trials: The Oxford vaccine has been through each of those stages, including 30,000 volunteers in the phase three trial, and the team has as much data as any other vaccine trial. What hasn't happened is years of hanging around in between each phase.  Dr Mark Toshner, who has been involved in the trials at sites in Cambridge, said the idea that it took 10 years to trial a vaccine was misleading. He told the BBC: ""Most of the time, it's a lot of nothing.""  He describes it as a process of writing grant applications, having them rejected, writing them again, getting approval to do the trial, negotiating with manufacturers, and trying to recruit enough people to take part. It can take years to get from one phase to the next.  ""The process is long, not because it needs to be and not because it's safe, but because of the real world,"" Dr Toshner said. Safety has not been sacrificed. Instead the unparalleled scientific push to make the trials happen, the droves of people willing to take part, and of course the money blew many of the usual hold-ups aside.  That does not mean problems will not appear in the future - medical research cannot make those guarantees. Usually, side-effects of vaccines appear either at the time they are given or a few months afterwards. It is possible that rarer problems could emerge when millions of people are immunised, but this is true of every vaccine that has ever been developed.  Plans for giving regulatory approval and manufacturing the vaccine have also been dramatically speeded up.  The UK already has four million doses of the vaccine ready to deploy. The Oxford team partnered with pharmaceutical giant AstraZeneca, and the manufacture of the vaccine started long before the results came in. At the time it was a gamble, but it has paid off big time.  Regulators, who would normally wait until after the trials were concluded, have also been involved early. The Medicines and Healthcare products Regulatory Agency in the UK has been conducting ""rolling reviews"" of the safety, manufacturing standards and effectiveness of the Oxford vaccine. It means a decision on whether the vaccine can be used will come early.  The Oxford vaccine has - like those of Pfizer and Moderna - arrived in record time to a world in desperate need.  Follow James on Twitter Covid-19: Oxford University vaccine is highly effective Covid risk: 3 people, 3 very different Covid risks. What's yours? Covid: Oxford vaccine shows 'encouraging' immune response in older adults Covid: No safety concerns found with Oxford vaccine trial after Brazil death Football legend Maradona dies aged 60 Argentina legend Diego Maradona, one of the greatest footballers of all time, dies at the age of 60. Lecturer 'released by Iran in prisoner swap' Meghan tells of 'unbearable grief' of miscarriage Spending Review: Key points at-a-glance Maradona: An extraordinary life in pictures How sunshine can make the railways greener. VideoHow sunshine can make the railways greener Coronavirus: Do you have a tribute to a loved one? Could Biden's win doom this town? The UK economy remains in rescue mode Tech making it easier to see inside babies' brains. VideoTech making it easier to see inside babies' brains Dating coach reveals dilemma when starting out Pandemic highlights anger at Amazon in France. VideoPandemic highlights anger at Amazon in France How a smalltown doctor became a Covid pariah Meghan: Duchess of Sussex tells of miscarriage 'pain and grief'1 Diego Maradona: Argentina legend dies aged 602 Kylie Moore-Gilbert: Lecturer 'released by Iran' in prisoner swap3 21 Savage: Rapper's brother stabbed to death in Lambeth4 Europe migrant crisis: Rescuers find owners of wedding rings lost at sea5 US election 2020: Biden says White House co-operation 'sincere'6 The Weeknd calls Grammy Awards 'corrupt' after nominations snub7 SLS: Nasa 'megarocket' assembly begins in Florida8 A harsh reality in coal country - with or without Trump9 Germany Merkel: Car rams into chancellery gate ahead of Covid decision10 © 2020 BBC. The BBC is not responsible for the content of external sites. Read about our approach to external linking."
Spending Review: Key points at-a-glance,,https://www.bbc.com//news/uk-politics-55072003,Spending Review: Key points from Rishi Sunak's statement - BBC News,"Chancellor Rishi Sunak has set out what the UK government will spend on health, education, transport and other public services next year. In a statement in Parliament, he also briefed MPs about the state of the UK economy and the latest forecasts for the UK's public finances, which have been battered by the Covid pandemic. Here are the main points.  Chancellor warns of 'lasting' damage to UK economy Low-paid public sector workers to get £250 pay rise Unemployed predicted to rise to 2.6 million £3bn for NHS but Sunak warns of 'economic shock' Sunak pledges to make jobs 'number one priority' Football legend Maradona dies aged 60 Argentina legend Diego Maradona, one of the greatest footballers of all time, dies at the age of 60. Lecturer 'released by Iran in prisoner swap' Meghan tells of 'unbearable grief' of miscarriage Spending Review: Key points at-a-glance Maradona: An extraordinary life in pictures How sunshine can make the railways greener. VideoHow sunshine can make the railways greener Coronavirus: Do you have a tribute to a loved one? Could Biden's win doom this town? The UK economy remains in rescue mode Tech making it easier to see inside babies' brains. VideoTech making it easier to see inside babies' brains Dating coach reveals dilemma when starting out Pandemic highlights anger at Amazon in France. VideoPandemic highlights anger at Amazon in France How a smalltown doctor became a Covid pariah Meghan: Duchess of Sussex tells of miscarriage 'pain and grief'1 Diego Maradona: Argentina legend dies aged 602 Kylie Moore-Gilbert: Lecturer 'released by Iran' in prisoner swap3 21 Savage: Rapper's brother stabbed to death in Lambeth4 Europe migrant crisis: Rescuers find owners of wedding rings lost at sea5 The Weeknd calls Grammy Awards 'corrupt' after nominations snub6 US election 2020: Biden says White House co-operation 'sincere'7 SLS: Nasa 'megarocket' assembly begins in Florida8 Germany Merkel: Car rams into chancellery gate ahead of Covid decision9 A harsh reality in coal country - with or without Trump10 © 2020 BBC. The BBC is not responsible for the content of external sites. Read about our approach to external linking."
What are the Covid rules at Christmas?,,https://www.bbc.com//news/explainers-55056375,Christmas Covid rules: Who are you allowed to see? - BBC News,"By Eleanor LawrieBBC News At Christmas, coronavirus restrictions will be eased to allow people to mix with a slightly wider circle of family and friends. Across the UK, people will be able to form ""bubbles"" of three households over a five-day period.  Between 23 and 27 December, the three households will be allowed to form a temporary ""Christmas bubble"". They can mix indoors and stay overnight. Northern Ireland has been granted a longer window of 22 to 28 December, to allow time to travel between the nations. Bubbles will be allowed to meet each other:  The bubbles will be fixed, so you will not be able to mix with two households on Christmas Day and two different ones on Boxing Day. Households in your Christmas bubble can't bubble with anyone else. There will be no limit to the number of people in a household joining a bubble. However, the rules about what counts as a household will depend on where you are. In England if you have formed a support bubble with another household, that counts as one household, so you can join with two other households in a Christmas bubble. People who are self-isolating should not join a Christmas bubble. If someone tests positive, or develops coronavirus symptoms up to 48 hours after the Christmas bubble last met, everyone will have to self-isolate. Travel restrictions will be lifted to allow people to visit their families anywhere in the UK.  But the government has warned that there will not be extra public transport laid on. It has urged people to plan their travel in advance. You will not be allowed to go with your Christmas bubble to hospitality settings, such as pubs and restaurants, or to entertainment venues. You can meet people outside your Christmas bubble, but only outside the home and in line with the tier rules of the area in which you are staying. Places you can meet include parks, beaches, open countryside, public gardens, allotments and playgrounds. Scottish First Minister Nicola Sturgeon said the relaxation of restrictions will not be extended to cover New Year's Eve. She said: ""I know New Year is special for people, perhaps slightly more so in Scotland than in other parts of the UK, but the virus is still there."" The virus will not call a truce because it is Christmas, and will be as contagious as at any other time, UK Prime Minister Boris Johnson has said. Even if it is within the rules, meeting friends and family over Christmas will be a ""personal judgement"", the government says. People should consider the risks to themselves and others, particularly those who are vulnerable. Scotland's First Minister Nicola Sturgeon urged people to use the Christmas rules responsibly and ""only if you think it is necessary"". Children of parents who live apart are allowed to be part of two separate Christmas bubbles. This means they can see both parents without being counted as part of another household. University students may return to their parents in the early December ""travel window"" and be counted as part of their household straight away. But if parents have three or more grown-up children who are not at university, then they cannot all form a Christmas bubble with their parents. Individual households can split for Christmas. So, if three people are sharing a home, they can all go and form separate Christmas bubbles with their families and come back to form a single household again afterwards.  In England, care home residents have been told not to take part in Christmas bubbles, while visits out of the home should only be considered by residents who are of ""working age"". This is because of the increased risk of the resident catching coronavirus, and spreading it to other vulnerable people when they return, the government says. People are asked to consider whether visiting at the care home would ""provide meaningful contact in a safer way"", while residents who do leave will be tested and asked to isolate when they return. Football legend Maradona dies aged 60 Argentina legend Diego Maradona, one of the greatest footballers of all time, dies at the age of 60. Lecturer 'released by Iran in prisoner swap' Meghan tells of 'unbearable grief' of miscarriage Spending Review: Key points at-a-glance Maradona: An extraordinary life in pictures How sunshine can make the railways greener. VideoHow sunshine can make the railways greener Coronavirus: Do you have a tribute to a loved one? Could Biden's win doom this town? The UK economy remains in rescue mode Tech making it easier to see inside babies' brains. VideoTech making it easier to see inside babies' brains Dating coach reveals dilemma when starting out Pandemic highlights anger at Amazon in France. VideoPandemic highlights anger at Amazon in France How a smalltown doctor became a Covid pariah Meghan: Duchess of Sussex tells of miscarriage 'pain and grief'1 Diego Maradona: Argentina legend dies aged 602 Kylie Moore-Gilbert: Lecturer 'released by Iran' in prisoner swap3 21 Savage: Rapper's brother stabbed to death in Lambeth4 Europe migrant crisis: Rescuers find owners of wedding rings lost at sea5 The Weeknd calls Grammy Awards 'corrupt' after nominations snub6 US election 2020: Biden says White House co-operation 'sincere'7 SLS: Nasa 'megarocket' assembly begins in Florida8 Germany Merkel: Car rams into chancellery gate ahead of Covid decision9 A harsh reality in coal country - with or without Trump10 © 2020 BBC. The BBC is not responsible for the content of external sites. Read about our approach to external linking."
How to avoid catching Covid this Christmas,,https://www.bbc.com//news/explainers-55017034,Covid: How to keep the virus at bay this Christmas - BBC News,"By David ShukmanBBC science editor Christmas is coming but how can you celebrate it without giving the unwelcome gift of coronavirus? Cosy rooms packed with people, chatting, laughing, even singing, and sharing food and drink for hours are the norm for the festive season. Unfortunately, almost everything that's great for lifting our spirits at Christmas is also ideal for fuelling the pandemic. So here are the key questions to ask about any festivities.  No-one will be popular for saying this, but the evidence is clear - the larger the group, the greater the risk.  If it was summer and we could meet outside, where the virus gets dispersed in fresh air, it would be less of a problem. But it's winter, so everyone's inside.  And the more people who are involved, the greater the likelihood that someone may be a carrier of the virus - maybe without realising.  A study by Sage, the government's science advisory panel, concludes that if you double the number of people getting together, you get a fourfold increase in the odds of infection.  It also matters how many different households are meeting - the fewer the safer - because the more different homes which are mixing, the greater the potential for the virus to spread.   Passing around dishes and bottles, encouraging everyone to tuck in, is one of the most natural of instincts at Christmas. But the coronavirus can survive on surfaces, possibly for several hours, so plates and cutlery can become contaminated, which means you could be handing round the virus as well as the sprouts.  In the US, the official advice for this year's Thanksgiving dinners is to break totally with tradition by asking guests to bring their own food and drinks. It's also recommended that you control who's allowed in the kitchen, with one lucky person doing all the serving. Amid the excitement of reunions, it's perfectly normal for voices to be raised.  Add a little alcohol, and maybe have a TV or music on as well, and things get even noisier. But if someone is infected, the louder they speak, the more virus they release.  A lot of research shows that when voices are projected, people emit more tiny droplets of the kind that can carry the coronavirus. That's why for Thanksgiving gatherings, the US government advises: ""Encourage guests to avoid singing or shouting, especially indoors.  ""Keep music levels down so people don't have to shout or speak loudly to be heard."" Maybe the safest option is to hum Silent Night. Popping in for a quick visit is safer than lingering over dinner for several hours.  Researchers say an event's duration has a big impact on the infection risk. In March, more than 50 members of a choir in the US were confirmed or suspected of being infected, after a two-and-a-half-hour rehearsal session.  Scientists reckoned that if it had lasted less than an hour, the number of infections would have been reduced by more than half.    Prof Cath Noakes, one of the study's authors, says the problem is that tiny particles carrying the virus, known as aerosols, can accumulate in the air.   ""There is growing evidence that if you're in a poorly-ventilated space for a long period of time with people who are infected, you may breathe in those aerosols and that might be one of the routes of infection,"" she said. The obvious answer is: ""Of course not, it's too cold outside."" But fresh air dilutes any virus that might be lingering in a crowded room. A Sage report says infection risks can be increased by four times without proper ventilation. And in this context, ""ventilation"" doesn't mean having fans blowing the air around, but a flow of air from outside. And if people feel too cold? Wear another layer. According to Prof Noakes, people must dream up creative new options for Christmas That could range from meeting virtually on Zoom, going for a walk, braving the weather for a picnic, or even delaying big gatherings until next summer.  If you are planning a meal indoors, she says, make sure you keep everyone as far apart as possible and be careful to keep everything clean. Also try to avoid having people from different households sitting opposite each other because speaking face-to-face is a route of transmission. Any social setting increases the risk of infection, says Prof Noakes, and we will have to compromise, reduce our contacts with people and do things in a different way. ""The virus doesn't know it's Christmas,"" she says. ""It's just a virus and it thrives on human contact."" Covid: Seven things that may be different this Christmas Covid: Can we rescue the office Christmas party this year? Covid-19: Family Christmas get-togethers being considered Football legend Maradona dies aged 60 Argentina legend Diego Maradona, one of the greatest footballers of all time, dies at the age of 60. Lecturer 'released by Iran in prisoner swap' Meghan tells of 'unbearable grief' of miscarriage Spending Review: Key points at-a-glance Maradona: An extraordinary life in pictures How sunshine can make the railways greener. VideoHow sunshine can make the railways greener Coronavirus: Do you have a tribute to a loved one? Could Biden's win doom this town? The UK economy remains in rescue mode Tech making it easier to see inside babies' brains. VideoTech making it easier to see inside babies' brains Dating coach reveals dilemma when starting out Pandemic highlights anger at Amazon in France. VideoPandemic highlights anger at Amazon in France How a smalltown doctor became a Covid pariah Meghan: Duchess of Sussex tells of miscarriage 'pain and grief'1 Diego Maradona: Argentina legend dies aged 602 Kylie Moore-Gilbert: Lecturer 'released by Iran' in prisoner swap3 21 Savage: Rapper's brother stabbed to death in Lambeth4 Europe migrant crisis: Rescuers find owners of wedding rings lost at sea5 The Weeknd calls Grammy Awards 'corrupt' after nominations snub6 US election 2020: Biden says White House co-operation 'sincere'7 SLS: Nasa 'megarocket' assembly begins in Florida8 Germany Merkel: Car rams into chancellery gate ahead of Covid decision9 A harsh reality in coal country - with or without Trump10 © 2020 BBC. The BBC is not responsible for the content of external sites. Read about our approach to external linking."
