Headline,Summary,News Link,News Title,News Summary
Spending Review: Key points at-a-glance,Chancellor Rishi Sunak has set out what the government will spend next year. Here are the headlines.,https://www.bbc.com//news/uk-politics-55072003,Spending Review: Key points from Rishi Sunak's statement - BBC News,"Chancellor Rishi Sunak has set out what the UK government will spend on health, education, transport and other public services next year. In a statement in Parliament, he also briefed MPs about the state of the UK economy and the latest forecasts for the UK's public finances, which have been battered by the Covid pandemic. Here are the main points.  Chancellor warns of 'lasting' damage to UK economy Low-paid public sector workers to get £250 pay rise Unemployed predicted to rise to 2.6 million £3bn for NHS but Sunak warns of 'economic shock' Sunak pledges to make jobs 'number one priority' Football legend Maradona dies aged 60 Argentina legend Diego Maradona, one of the greatest footballers of all time, dies at the age of 60. Lecturer 'released by Iran in prisoner swap' Meghan tells of 'unbearable grief' of miscarriage Spending Review: Key points at-a-glance Maradona: An extraordinary life in pictures How sunshine can make the railways greener. VideoHow sunshine can make the railways greener Coronavirus: Do you have a tribute to a loved one? Could Biden's win doom this town? The UK economy remains in rescue mode Tech making it easier to see inside babies' brains. VideoTech making it easier to see inside babies' brains Dating coach reveals dilemma when starting out Pandemic highlights anger at Amazon in France. VideoPandemic highlights anger at Amazon in France How a smalltown doctor became a Covid pariah Meghan: Duchess of Sussex tells of miscarriage 'pain and grief'1 Diego Maradona: Argentina legend dies aged 602 Kylie Moore-Gilbert: Lecturer 'released by Iran' in prisoner swap3 21 Savage: Rapper's brother stabbed to death in Lambeth4 Europe migrant crisis: Rescuers find owners of wedding rings lost at sea5 The Weeknd calls Grammy Awards 'corrupt' after nominations snub6 US election 2020: Biden says White House co-operation 'sincere'7 SLS: Nasa 'megarocket' assembly begins in Florida8 Germany Merkel: Car rams into chancellery gate ahead of Covid decision9 A harsh reality in coal country - with or without Trump10 © 2020 BBC. The BBC is not responsible for the content of external sites. Read about our approach to external linking."
What are the Covid rules at Christmas?,"Restrictions will be temporarily eased around the UK, but there are still rules about what you can do.",https://www.bbc.com//news/explainers-55056375,Christmas Covid rules: Who are you allowed to see? - BBC News,"By Eleanor LawrieBBC News At Christmas, coronavirus restrictions will be eased to allow people to mix with a slightly wider circle of family and friends. Across the UK, people will be able to form ""bubbles"" of three households over a five-day period.  Between 23 and 27 December, the three households will be allowed to form a temporary ""Christmas bubble"". They can mix indoors and stay overnight. Northern Ireland has been granted a longer window of 22 to 28 December, to allow time to travel between the nations. Bubbles will be allowed to meet each other:  The bubbles will be fixed, so you will not be able to mix with two households on Christmas Day and two different ones on Boxing Day. Households in your Christmas bubble can't bubble with anyone else. There will be no limit to the number of people in a household joining a bubble. However, the rules about what counts as a household will depend on where you are. In England if you have formed a support bubble with another household, that counts as one household, so you can join with two other households in a Christmas bubble. People who are self-isolating should not join a Christmas bubble. If someone tests positive, or develops coronavirus symptoms up to 48 hours after the Christmas bubble last met, everyone will have to self-isolate. Travel restrictions will be lifted to allow people to visit their families anywhere in the UK.  But the government has warned that there will not be extra public transport laid on. It has urged people to plan their travel in advance. You will not be allowed to go with your Christmas bubble to hospitality settings, such as pubs and restaurants, or to entertainment venues. You can meet people outside your Christmas bubble, but only outside the home and in line with the tier rules of the area in which you are staying. Places you can meet include parks, beaches, open countryside, public gardens, allotments and playgrounds. Scottish First Minister Nicola Sturgeon said the relaxation of restrictions will not be extended to cover New Year's Eve. She said: ""I know New Year is special for people, perhaps slightly more so in Scotland than in other parts of the UK, but the virus is still there."" The virus will not call a truce because it is Christmas, and will be as contagious as at any other time, UK Prime Minister Boris Johnson has said. Even if it is within the rules, meeting friends and family over Christmas will be a ""personal judgement"", the government says. People should consider the risks to themselves and others, particularly those who are vulnerable. Scotland's First Minister Nicola Sturgeon urged people to use the Christmas rules responsibly and ""only if you think it is necessary"". Children of parents who live apart are allowed to be part of two separate Christmas bubbles. This means they can see both parents without being counted as part of another household. University students may return to their parents in the early December ""travel window"" and be counted as part of their household straight away. But if parents have three or more grown-up children who are not at university, then they cannot all form a Christmas bubble with their parents. Individual households can split for Christmas. So, if three people are sharing a home, they can all go and form separate Christmas bubbles with their families and come back to form a single household again afterwards.  In England, care home residents have been told not to take part in Christmas bubbles, while visits out of the home should only be considered by residents who are of ""working age"". This is because of the increased risk of the resident catching coronavirus, and spreading it to other vulnerable people when they return, the government says. People are asked to consider whether visiting at the care home would ""provide meaningful contact in a safer way"", while residents who do leave will be tested and asked to isolate when they return. Football legend Maradona dies aged 60 Argentina legend Diego Maradona, one of the greatest footballers of all time, dies at the age of 60. Lecturer 'released by Iran in prisoner swap' Meghan tells of 'unbearable grief' of miscarriage Spending Review: Key points at-a-glance Maradona: An extraordinary life in pictures How sunshine can make the railways greener. VideoHow sunshine can make the railways greener Coronavirus: Do you have a tribute to a loved one? Could Biden's win doom this town? The UK economy remains in rescue mode Tech making it easier to see inside babies' brains. VideoTech making it easier to see inside babies' brains Dating coach reveals dilemma when starting out Pandemic highlights anger at Amazon in France. VideoPandemic highlights anger at Amazon in France How a smalltown doctor became a Covid pariah Meghan: Duchess of Sussex tells of miscarriage 'pain and grief'1 Diego Maradona: Argentina legend dies aged 602 Kylie Moore-Gilbert: Lecturer 'released by Iran' in prisoner swap3 21 Savage: Rapper's brother stabbed to death in Lambeth4 Europe migrant crisis: Rescuers find owners of wedding rings lost at sea5 US election 2020: Biden says White House co-operation 'sincere'6 The Weeknd calls Grammy Awards 'corrupt' after nominations snub7 SLS: Nasa 'megarocket' assembly begins in Florida8 A harsh reality in coal country - with or without Trump9 Germany Merkel: Car rams into chancellery gate ahead of Covid decision10 © 2020 BBC. The BBC is not responsible for the content of external sites. Read about our approach to external linking."
How to avoid catching Covid this Christmas,Christmas could be a dangerous time to contract the virus - but precautions can be taken.,https://www.bbc.com//news/explainers-55017034,Covid: How to keep the virus at bay this Christmas - BBC News,"By David ShukmanBBC science editor Christmas is coming but how can you celebrate it without giving the unwelcome gift of coronavirus? Cosy rooms packed with people, chatting, laughing, even singing, and sharing food and drink for hours are the norm for the festive season. Unfortunately, almost everything that's great for lifting our spirits at Christmas is also ideal for fuelling the pandemic. So here are the key questions to ask about any festivities.  No-one will be popular for saying this, but the evidence is clear - the larger the group, the greater the risk.  If it was summer and we could meet outside, where the virus gets dispersed in fresh air, it would be less of a problem. But it's winter, so everyone's inside.  And the more people who are involved, the greater the likelihood that someone may be a carrier of the virus - maybe without realising.  A study by Sage, the government's science advisory panel, concludes that if you double the number of people getting together, you get a fourfold increase in the odds of infection.  It also matters how many different households are meeting - the fewer the safer - because the more different homes which are mixing, the greater the potential for the virus to spread.   Passing around dishes and bottles, encouraging everyone to tuck in, is one of the most natural of instincts at Christmas. But the coronavirus can survive on surfaces, possibly for several hours, so plates and cutlery can become contaminated, which means you could be handing round the virus as well as the sprouts.  In the US, the official advice for this year's Thanksgiving dinners is to break totally with tradition by asking guests to bring their own food and drinks. It's also recommended that you control who's allowed in the kitchen, with one lucky person doing all the serving. Amid the excitement of reunions, it's perfectly normal for voices to be raised.  Add a little alcohol, and maybe have a TV or music on as well, and things get even noisier. But if someone is infected, the louder they speak, the more virus they release.  A lot of research shows that when voices are projected, people emit more tiny droplets of the kind that can carry the coronavirus. That's why for Thanksgiving gatherings, the US government advises: ""Encourage guests to avoid singing or shouting, especially indoors.  ""Keep music levels down so people don't have to shout or speak loudly to be heard."" Maybe the safest option is to hum Silent Night. Popping in for a quick visit is safer than lingering over dinner for several hours.  Researchers say an event's duration has a big impact on the infection risk. In March, more than 50 members of a choir in the US were confirmed or suspected of being infected, after a two-and-a-half-hour rehearsal session.  Scientists reckoned that if it had lasted less than an hour, the number of infections would have been reduced by more than half.    Prof Cath Noakes, one of the study's authors, says the problem is that tiny particles carrying the virus, known as aerosols, can accumulate in the air.   ""There is growing evidence that if you're in a poorly-ventilated space for a long period of time with people who are infected, you may breathe in those aerosols and that might be one of the routes of infection,"" she said. The obvious answer is: ""Of course not, it's too cold outside."" But fresh air dilutes any virus that might be lingering in a crowded room. A Sage report says infection risks can be increased by four times without proper ventilation. And in this context, ""ventilation"" doesn't mean having fans blowing the air around, but a flow of air from outside. And if people feel too cold? Wear another layer. According to Prof Noakes, people must dream up creative new options for Christmas That could range from meeting virtually on Zoom, going for a walk, braving the weather for a picnic, or even delaying big gatherings until next summer.  If you are planning a meal indoors, she says, make sure you keep everyone as far apart as possible and be careful to keep everything clean. Also try to avoid having people from different households sitting opposite each other because speaking face-to-face is a route of transmission. Any social setting increases the risk of infection, says Prof Noakes, and we will have to compromise, reduce our contacts with people and do things in a different way. ""The virus doesn't know it's Christmas,"" she says. ""It's just a virus and it thrives on human contact."" Covid: Seven things that may be different this Christmas Covid: Can we rescue the office Christmas party this year? Covid-19: Family Christmas get-togethers being considered Football legend Maradona dies aged 60 Argentina legend Diego Maradona, one of the greatest footballers of all time, dies at the age of 60. Lecturer 'released by Iran in prisoner swap' Meghan tells of 'unbearable grief' of miscarriage Spending Review: Key points at-a-glance Maradona: An extraordinary life in pictures How sunshine can make the railways greener. VideoHow sunshine can make the railways greener Coronavirus: Do you have a tribute to a loved one? Could Biden's win doom this town? The UK economy remains in rescue mode Tech making it easier to see inside babies' brains. VideoTech making it easier to see inside babies' brains Dating coach reveals dilemma when starting out Pandemic highlights anger at Amazon in France. VideoPandemic highlights anger at Amazon in France How a smalltown doctor became a Covid pariah Meghan: Duchess of Sussex tells of miscarriage 'pain and grief'1 Diego Maradona: Argentina legend dies aged 602 Kylie Moore-Gilbert: Lecturer 'released by Iran' in prisoner swap3 21 Savage: Rapper's brother stabbed to death in Lambeth4 Europe migrant crisis: Rescuers find owners of wedding rings lost at sea5 The Weeknd calls Grammy Awards 'corrupt' after nominations snub6 US election 2020: Biden says White House co-operation 'sincere'7 SLS: Nasa 'megarocket' assembly begins in Florida8 Germany Merkel: Car rams into chancellery gate ahead of Covid decision9 A harsh reality in coal country - with or without Trump10 © 2020 BBC. The BBC is not responsible for the content of external sites. Read about our approach to external linking."
Rishi Sunak's plans: Four things to look out for,The Spending Review marks the start of the chancellor's economic recovery strategy. Here's what to watch for.,https://www.bbc.com//news/business-55043908,Rishi Sunak's Spending Review: Four things to look out for - BBC News,"By Russell HottenBusiness reporter, BBC News On Wednesday, Chancellor Rishi Sunak begins setting out plans for what he hopes will be an economy beyond Covid-19.  This Spending Review - detailing the money government departments will get for things like the NHS, education, roads, and police - only covers the financial year 2021-22. It will also set out money for the devolved administrations Scotland, Wales and Northern Ireland. In normal times, reviews cover three or four years. But such is the economic uncertainty that this look-ahead has been limited to the next 12 months.  Even so, Mr Sunak will point to the direction of travel for spending (and possibly tax rises) for future years. Few reviews can have been so anticipated. Here's what to watch out for. The economic shock has left the UK poorer. By the end of this year the economy is expected to be at least 10% smaller than pre-pandemic.  Alongside the Spending Review, Mr Sunak will disclose latest forecasts for the economy and public finances from the independent Office for Budget Responsibility (OBR). Earlier this year, the OBR forecast a 13% contraction. While it is not expected to be that bad, the shrinkage will still likely be in the double-digits, and with public borrowing topping £350bn - something not seen in peacetime.  A difficulty for the chancellor is that big tranches of public service spending have already been made. Despite that, some areas will reportedly get more: NHS England, schools and defence. According to the Institute for Fiscal Studies (IFS), some two-thirds of public service spending has been pre-determined.  The key question is whether the remaining third is enough to go round. The answer is almost certainly not. The IFS thinks ""unprotected"" services such as the courts, prisons or local government are vulnerable to cuts. The overseas aid budget is also in the line of fire. Saving, not spending, will dominate Wednesday's agenda. And one of the biggest savings could be a public sector pay freeze. It would be hugely controversial. Media leaks last week claimed Mr Sunak wants a freeze for everyone except frontline NHS staff.  That won't go down well with the police, teachers, civil servants or anyone who thinks they've done their bit to ensure the public sector keeps going in tough times. Even a return to a 1% cap is likely to be fiercely resisted. Some commentators think the media reports were Treasury kite-flying. Even so, in the summer, Mr Sunak suggested that as private sector pay had taken a huge hit, in the ""interest of fairness"" the public sector's 5.4 million workers should share some pain. Trouble is, relative to pay in the private sector, public sector pay has fallen to its lowest level in decades, according to the IFS.  Only during the pandemic has public sector pay performed more strongly than in the private sector. Union leaders have already warned of industrial action to ensure members' pay does not fall further behind.  Many promises have been thrown off-course because of the pandemic, and the government will be keen to get its north-south levelling up agenda back on track as soon as possible. Infrastructure spending is key to this.  The north has long complained that the Treasury methodology used to calculate the cost-benefit of spending money on big projects is inherently biased towards London and the rest of the south east. So, expect some changes to these calculations. And watch out for whether any spending promises are new money, or simply projects brought forward. To underline his commitment to spend on big long-term projects, there is talk that Mr Sunak could publish details of a National Infrastructure Strategy and a Research and Development Strategy.   And in a symbolic move that levelling up is more than a question of infrastructure, the Financial Times has reported that the chancellor could also announce that parts of government could relocate from the capital - with the Treasury leading the way. While Wednesday will be about spending and borrowing, at some point the chancellor will have to decide how it will be paid for. He will start to address this in next March's Budget, although most economic commentators feel the economy will still be too fragile for major tax rises. It is possible that, with the success of a Covid vaccine, the economy could bounce back, limiting the need for big rises. However, Paul Johnson, director of the IFS, told the BBC that four or five years down the road he still expects the economy to be about 4%-5% smaller than before the pandemic. Rein in spending and raise taxes too early, and recovery will be choked off. Leave it too late, and the public finances will spin out of control.  ""It's a fine judgement,"" said Mr Johnson. Both the chancellor and Prime Minister Boris Johnson have, however, said they don't want a return to austerity.  There have been reports the Treasury could raise money from changes to Capital Gains Tax, pensions relief or self-employment taxes. But this is tinkering.  Mr Johnson believes £40bn of tax rises are necessary over the short-term, and that sort of money cannot be raised without touching the Big Three: income tax, VAT or national insurance. These bring in almost two-thirds of government revenue. Spending Review: What is it and how does it affect me? Coronavirus: £3bn for NHS but Sunak warns of 'economic shock' to come Football legend Maradona dies aged 60 Argentina legend Diego Maradona, one of the greatest footballers of all time, dies at the age of 60. Lecturer 'released by Iran in prisoner swap' Meghan tells of 'unbearable grief' of miscarriage Spending Review: Key points at-a-glance Maradona: An extraordinary life in pictures How sunshine can make the railways greener. VideoHow sunshine can make the railways greener Coronavirus: Do you have a tribute to a loved one? Could Biden's win doom this town? The UK economy remains in rescue mode Tech making it easier to see inside babies' brains. VideoTech making it easier to see inside babies' brains Dating coach reveals dilemma when starting out Pandemic highlights anger at Amazon in France. VideoPandemic highlights anger at Amazon in France How a smalltown doctor became a Covid pariah Meghan: Duchess of Sussex tells of miscarriage 'pain and grief'1 Diego Maradona: Argentina legend dies aged 602 Kylie Moore-Gilbert: Lecturer 'released by Iran' in prisoner swap3 21 Savage: Rapper's brother stabbed to death in Lambeth4 Europe migrant crisis: Rescuers find owners of wedding rings lost at sea5 US election 2020: Biden says White House co-operation 'sincere'6 The Weeknd calls Grammy Awards 'corrupt' after nominations snub7 SLS: Nasa 'megarocket' assembly begins in Florida8 A harsh reality in coal country - with or without Trump9 Germany Merkel: Car rams into chancellery gate ahead of Covid decision10 © 2020 BBC. The BBC is not responsible for the content of external sites. Read about our approach to external linking."
